{"schema_version":"1.0","scenario_id":"minimal_original","title":"消えた時計","rules_profile":"coc7e_quick_start_2016_ja","status":"ready","status_reason":"validated authored fixture","blocking_issues":[],"source":[{"path":"source/scenario.md","sha256":"ee1fa8a76917ce924d0d46006f8f4c57416eca7d11bbda14448abf6d5b5e33da","media_type":"text/markdown","immutable":true}],"opening":{"scene_id":"entrance","location":"博物館の玄関ホール","participants":["investigator","saeki"]},"actors":[{"id":"investigator","role":"player"},{"id":"saeki","role":"npc"}],"secrecy":{"classified":true,"public_import_report":"ready"},"current_scene_id":null,"last_checkpoint_id":null,"state_version":0,"updated_at":"2026-07-26T00:00:00Z"}
