{"schema_version":"1.0","scenario_id":"replace_me","title":"Replace me","rules_profile":"coc7e_quick_start_2016_ja","status":"importing","status_reason":"source import started","blocking_issues":[],"source":[],"opening":{"scene_id":"opening","location":"replace me","participants":["investigator"]},"actors":[{"id":"investigator","role":"player"}],"secrecy":{"classified":false,"public_import_report":"blocked"},"current_scene_id":null,"last_checkpoint_id":null,"state_version":0,"updated_at":"1970-01-01T00:00:00Z"}
